judul,isi,tanggal,kategori
Dosen ITB Ungkap Biang Kerok Jumlah Kelas Menengah Turun,"Dosen Sekolah Bisnis dan Manajemen (SBM) Institut Teknologi Bandung (ITB) Muhammad Yorga Permana menilai kurangnya lapangan kerja di sektor formal menjadi penyebab menurunnya jumlah kelas menengah. Ia mengatakan banyak pekerja di sektor formal yang beralih ke sektor informal, terutama pasca pandemi covid-19. Kemudian banyak juga angkatan kerja baru yang langsung masuk ke sektor informal karena minimnya pekerjaan di sektor formal. Padahal, sektor informal cenderung tidak layak karena tak mendapatkan pendapatan yang memadai dan tak memiliki jaminan sosial. ""Saya percaya bahwa middle class (kelas menengah) yang bertumbuh tidak bisa hadir, tidak bisa ada terus, tanpa adanya akses pada pekerjaan yang baik dan stabil. Inilah yang membuat pekerjaan yang layak semakin mendesak untuk kelas menengah karena ini yang bisa membuat mereka stabil dan tidak turun kelas,"" katanya dalam Diskusi Publik INDEF ""Kelas Menengah Turun Kelas"", Senin (9/9). Basuki Terisak saat Pamitan ke DPR: Saya Mules Setiap Berangkat Rapat Yorga mengatakan penurunan jumlah pekerja di sektor formal mulai terlihat pada 2014, di mana pekerjaan sektor formal tetap tumbuh 2 juta per tahun seperti tahun-tahun sebelumnya, tetapi pekerja mandiri (self employment) juga meningkat, hingga kemudian terjadi fenomena gig economy. Gig economy ini adalah kondisi saat pasar tenaga kerja didominasi oleh pekerjaan sementara, lepas, dan kontrak, seperti driver ojek online (ojol). Fenomena itu terus terjadi hingga pekerja informal mendominasi. ""Dan ketika covid hadir akhirnya baru kita tahu ekonomi kita rentan, ada 10 juta pekerjaan baru di sektor informal dan pekerja formal hanya meningkat 2 juta. Di sini masalahnya mengapa kelas menengah turun, artinya memang banyak pekerja yang asalnya formal pindah ke informal,"" imbuhnya. Badan Pusat Statistik (BPS) mencatat jumlah penduduk kelas menengah di Indonesia mencapai 47,85 juta orang pada 2024, turun dibandingkan 2023 yang mencapai 48,27 juta orang. Plt Kepala BPS Amalia Adininggar mengatakan penyebab utama turunnya kelas menengah tahun ini adalah pandemi Covid-19. Tercermin dari data yang dimiliki, penurunan jumlah penduduk kelas menengah berkurang sejak 2019. Menurutnya, efek pandemi pada 2020 lalu masih terasa sampai saat ini, terutama kepada perekonomian. Masyarakat kelas menengah pun turut merasakan dampaknya. ""Kan tadi sudah dilihat dari 2014 ke 2019 kan naik (kelas menengah) dari 41 persen jadi 53 persen. Setelah pandemi, dia turun bertahap, itu yang saya tadi bilang, ada long covid buat perekonomian,"" ujarnya dalam konferensi pers, Jumat (30/8). [Gambas:Video CNN] (fby/pta)","Selasa, 10 Sep 2024 12:10 WIB",Ekonomi
Cara Menghitung Pajak untuk Makanan dan Minuman,"Bagi para pemilik usaha di bidang makanan dan minuman, ada kewajiban perpajakan yang harus dipenuhi, yakni Pajak Barang dan Jasa Tertentu (PNJT) atas Makanan dan/atau Minuman. Peraturan Daerah DKI Jakarta Nomor 1 Tahun 2024 menyatakan, PBJT merupakan pajak yang dibayarkan oleh konsumen akhir atas konsumsi barang dan/atau jasa tertentu. Dalam Pasal 51 ayat (1) huruf a Perda 1/2024, dicantumkan bahwa dasar pengenaan PBJT merupakan jumlah yang dibayarkan oleh konsumen barang dan jasa tertentu. Hal itu antara lain mencakup jumlah pembayaran yang diterima oleh penyedia makanan dan/atau minuman untuk PBJT atas makanan dan/atau minuman. Kepala Pusat Data dan Informasi Pendapatan Bapenda Jakarta Morris Danny mengatakan, atas ketentuan tersebut, besaran pokok PBJT makanan dan/atau minuman yang terutang dapat dihitung, di mana tarif PBJT makanan dan/atau minuman sebesar 10 persen dikalikan dengan dasar pengenaan PBJT atas makanan dan/atau minuman (jumlah yang diterima oleh penyedia makanan dan/atau minuman). ""Apabila terdapat potongan harga atas transaksi penjualan, maka pengenaan PBJT makanan dan/atau minuman adalah jumlah yang diterima oleh penyedia makanan dan/atau minuman setelah dikurangi potongan harga,"" kata Morris Danny. Simulasi Perhitungan PBJT atas Makanan dan/atau Minuman Misalnya, Jaenab yang hendak makan di restoran, memesan sejumlah menu senilai Rp100 ribu, dengan diskon sebesar 20 persen dan service charge yang dikenakan restoran sebesar 5 persen. Ada dua cara penghitungan pajak. Pertama: Rp100.000 - diskon 20 persen = Rp80.000 (Dasar Pengenaan PBJT Makanan dan/atau minuman setelah diskon)Rp80.000 X service charge 5 persen = Rp4.000Rp(80.000+4.000) X PBJT Restoran 10 persen = Rp8.400Jadi, total tagihan yang dibayarkan Jaenab adalah sebesar Rp(80.000+4.000+8.400) = Rp92.400 Kedua: Rp100.000 - diskon 20 persen = Rp80.000 (Dasar Pengenaan PBJT Makanan dan/atau minuman setelah diskon)Rp100.000 X service charge 5 persen = Rp5.000Rp(80.000+5.000) X PBJT Restoran 10 persen = Rp8.500Jadi, total tagihan yang dibayarkan Jaenab adalah sebesar Rp(80.000+5.000+8.500) = Rp93.500 Dengan penjelasan dasar pengenaan PBJT atas makanan-minuman seperti di atas, Morris berharap masyarakat, khususnya pelaku usaha di bidang kuliner dapat memahami kewajiban pajak atas Pajak Barang dan Jasa Tertentu untuk makanan dan/atau minuman. ""Yuk, sama-sama berkontribusi untuk mendukung perekonomian daerah,"" ujar Morris. (rea/rir) [Gambas:Video CNN]","Selasa, 10 Sep 2024 12:02 WIB",Ekonomi
"Sepakati 13 PKS Baru, Pertamina Dukung Percepatan Perhutanan Sosial","PT Pertamina (Persero) turut dalam penandatanganan 13 Perjanjian Kerja Sama (PKS) dengan berbagai Kelompok Usaha Perhutanan Sosial (KUPS) di seluruh Indonesia sebagai bagian dari acara ""Sinergi Perhutanan Sosial Rimba Nusa"" di Bali, baru-baru ini. Corporate Secretary PT Pertamina (Persero) Brahmantya S. Poerwadi mengatakan, peran serta tersebut merupakan langkah nyata Pertamina dalam membantu masyarakat di sekitar hutan. Melalui kerja sama ini, Pertamina akan mendampingi 13 KUPS untuk mengembangkan usaha produktif di kawasan hutan sosial. Menurut Brahmantya, beberapa KUPS tersebut sudah mulai menghasilkan produk bernilai tambah, seperti madu hutan dan agrowisata. ""Penandatanganan ini adalah bagian dari upaya Pertamina untuk mendukung ekonomi lokal melalui pengelolaan hutan yang berkelanjutan. Kami berharap kerja sama ini dapat membantu meningkatkan kesejahteraan masyarakat serta menjaga kelestarian lingkungan,"" kata Brahmantya. Direktur Jenderal Perhutanan Sosial dan Kemitraan Lingkungan KLHK Mahfudz M.P. menekankan bahwa kolaborasi ini bukan hanya terkait tanggung jawab sosial, tetapi juga upaya bersama menciptakan akses pasar dan peluang ekonomi yang lebih besar. ""Kami berharap kelompok perhutanan sosial bisa memanfaatkan kerja sama ini untuk meningkatkan kapasitas usaha mereka,"" ujar Mahfudz. Senada, Vice President Corporate Communication Pertamina Fadjar Djoko Santoso optimis bahwa sinergi Pertamina dengan KUPS dapat memberikan dampak positif yang berkelanjutan bagi masyarakat sekitar hutan dan lingkungan. Terlebih, upaya ini mendukung pencapaian Tujuan Pembangunan Berkelanjutan (TPB), khususnya terkait kesejahteraan masyarakat serta ekosistem daratan. ""Dalam berbagai upaya tanggung jawab sosial lingkungan, Pertamina berupaya berkontribusi dalam menggerakan perekonomian. Kami berharap peran Pertamina ini dapat mendukung tercapainya tujuan pembangunan berkelanjutan di Indonesia,"" ujar Fadjar. (rea/rir) [Gambas:Video CNN]","Selasa, 10 Sep 2024 11:54 WIB",Ekonomi
Saaih Halilintar Gagal Ikut PON Karena Tidak Punya NPWP-BPJS Kesehatan,"Saaih Halilintar gagal mengikuti PON XXI Aceh-Sumut 2024. Hal itu terjadi karena adik Atta Halilintar itu tidak tidak memiliki Nomor Pokok Wajib Pajak (NPWP) dan BPJS Kesehatan. Asal tahu saja, NPWP dan kepesertaan BPJS merupakan salah satu syarat administrasi ikut PON. Manajer Tim PON Cabor Golf dari Provinsi Banten, Paulus Rudy mengungkap semua atlet harus memenuhi syarat administrasi KTP, NPWP, BPJS, Kartu Keluarga, hingga KIA. ""Pihak Saaih sampai tanggal 30 Juli ada WA ke saya, masih menanyakan 'Om apakah bisa NPWP-nya pakai orang tuanya?' Pertanyaan saya berarti, satu belum diurus, kedua saat itu juga saya menjawab, 'Maaf, Saaih belum bisa ikut PON karena tidak lolos sebagai administrasi',"" ungkap Paulus Rudy, dikutip dari detik.com. ANALISIS Segudang 'Bencana' Mengintai Jika Subsidi KRL Diubah Berbasis NIK Saaih merupakan YouTuber muda dan cukup dikenal di Indonesia. Pada usianya menginjak 22 tahun, Saaih memiliki 12 juta subscriber. Seperti diketahui penghasilan sebagai YouTuber bisa sangat fantastis apalagi dengan pengikut yang cukup banyak. Sebagai warga negara yang telah berpenghasilan, diwajibkan untuk membayar pajak yang ditandai dengan memiliki NPWP. Kepemilikan NPWP diatur dalam Peraturan Dirjen Pajak Nomor PER-04/PJ/2020 tentang Petunjuk Teknis Pelaksanaan Administrasi Nomor Pokok Wajib Pajak, Sertifikat Elektronik dan Pengukuhan Pengusaha Kena Pajak. Dalam aturan itu kepemilikan NPWP wajib bagi mereka yang sudah di atas 17 tahun dan memiliki penghasilan. ""Setiap Wajib Pajak yang telah memenuhi persyaratan subjektif dan objektif sesuai dengan ketentuan peraturan perundang-undangan perpajakan wajib mendaftarkan diri pada kantor Direktorat Jenderal Pajak yang wilayah kerjanya meliputi tempat tinggal atau tempat kedudukan Wajib Pajak dan kepadanya diberikan NPWP,"" bunyi aturan tersebut. [Gambas:Video CNN] (agt)","Selasa, 10 Sep 2024 11:39 WIB",Ekonomi
Daftar 7 Jenis Kendaraan yang Masih Diizinkan Beli Pertalite Cs,"Pemerintah bakal memberlakukan pembatasan kendaraan yang bisa membeli bahan bakar minyak (BBM) subsidi seperti pertalite. Tujuannya, agar bantuan yang diberikan kepada masyarakat miskin ini bisa tepat sasaran. Aturan pembatasan BBM subsidi akan diatur dalam Peraturan Menteri Energi dan Sumber Daya Mineral (Permen ESDM). Sampai saat ini, aturan masih dalam tahap finalisasi. Kepala Badan Pengatur Hilir Minyak dan Gas Bumi (BPH Migas) Erika Retnowati mengatakan masyarakat tidak perlu khawatir dengan aturan ini, khususnya pemilik angkutan umum dan layanan taksi online. Kepada mereka, pemerintah masih memberikan izin membeli BBM subsidi. ANALISIS Segudang 'Bencana' Mengintai Jika Subsidi KRL Diubah Berbasis NIK ""Yang menyangkut masyarakat banyak, yang dibutuhkan sehari-hari oleh masyarakat itu tetap mendapatkan subsidi. Seperti angkot, ojol, taxi online, bus umum,"" ujarnya dikutip dari CNBCIndonesia, Selasa (10/9). Selain itu, kendaraan logistik juga masih diperbolehkan untuk menggunakan BBM subsidi. Juga beberapa industri yang akan dipilah berdasarkan kriteria. ""Kemudian juga mungkin kalau di laut, transportasi laut, kemudian kereta api, semuanya masih tetap mendapatkan BBM bersubsidi,"" pungkasnya. Menteri Koordinator Bidang Kemaritiman dan Investasi (Menko Marves) Luhut Binsar Pandjaitan sebelumnya mengatakan kebijakan pembatasan pembelian pertalite Cs juga tak akan menyasar pengguna kendaraan roda dua alias motor. ""Ya kan kalau (BBM) subsidi katakanlah yang sepeda motor tuh enggak akan dicabut. Yang mau kita tertibkan adalah subsidi yang 6 persen-7 persen yang orang itu tidak berhak terima,"" jelas dia di JCC Senayan, Jumat (6/8), melansir CNBC Indonesia. Ia menyebutkan bahwa pemerintah tengah melaksanakan rapat untuk membahas pengetatan pembelian BBM bersubsidi di Indonesia. [Gambas:Video CNN] Nantinya, pihaknya bakal melarang 6-7 persen kendaraan untuk mengisi BBM subsidi. Hal itu sebab kendaraan tersebut termasuk jenis kendaraan yang dimiliki oleh orang mampu yang tak berhak menikmati BBM subsidi. Ia membeberkan nantinya pendataan masyarakat yang berhak membeli BBM bersubsidi akan menggunakan kecerdasan buatan (AI). ""Ya, yang tidak berhak terima (BBM subsidi) dengan sistem AI,"" imbuhnya. Luhut menekankan pemerintah masih akan menganggarkan dana untuk subsidi BBM. Ia memastikan subsidi BBM tak akan dicabut, melainkan hanya akan menertibkan siapa saja yang berhak menerima subsidi BBM. ""Kan masih rapat, nanti, sebenarnya enggak ada subsidi yang dicabut, tuh enggak ada,"" tandasnya. Pemerintah berencana membatasi pembelian pertalite dan BBM subsidi lainnya. Menteri Energi dan Sumber Daya Mineral (ESDM) Bahlil Lahadalia mengungkapkan pemerintah saat ini masih melakukan sosialisasi agar pelaksanaan pembatasan pembelian BBM subsidi pada 1 Oktober 2024 mendatang dapat diberlakukan. ""Memang ada rencana begitu (berlaku 1 Oktober), karena begitu aturannya keluar, permen (peraturan menteri)-nya keluar, itu kan ada waktu untuk sosialisasi. Waktu sosialisasi ini yang sedang saya bahas,"" ujar Bahlil di Kompleks DPR RI, Selasa (27/8). Kendati, Bahlil belum bisa membocorkan kriteria kendaraan seperti apa yang bakal diperbolehkan mendapat subsidi BBM. Ia mengatakan saat ini pembahasan masih terus berlanjut. (ldy/agt)","Selasa, 10 Sep 2024 11:25 WIB",Ekonomi
Satgas BLBI Butuh Rp10 M untuk Uber Tagihan Rp71 T ke Obligor,"Wakil Menteri Keuangan I Suahasil Nazara mengungkap butuh anggaran Rp10,25 miliar untuk melanjutkan program penanganan hak tagih negara yang sisanya sebesar Rp71 triliun oleh Satuan Tugas Penanganan Hak Tagih Negara Dana Bantuan Likuiditas Bank Indonesia (Satgas BLBI). ""Ini untuk rangkaian kasus BLBI hak tagih negara yang masih berproses dan untuk itu extra effort dan rencana aksi yang kami bayangkan dan dialokasikan Rp10,25 miliar,"" ujar Suahasil dalam Rapat Kerja dengan Komisi XI DPR RI, Senin (9/9). Anggaran tersebut bakal digunakan untuk pembentukan Komite Penanganan Hak Tagih Dana BLBI pengganti Satgas BLBI, hingga melanjutkan upaya pembatasan keperdataan atau layanan publik serta pencegahan bepergian ke luar negeri. Dana itu juga akan digunakan untuk meningkatkan penelusuran informasi terkait debitur dan obligor dengan nilai kewajiban besar dan terafiliasi antara lain dengan bantuan audit investigasi BPKP, serta pelatihan peningkatan kemampuan asset tracing bekerja sama dengan pemerintah Amerika Serikat (AS). Profil Marimutu Sinivasan, Buron BLBI yang Ditangkap Saat Mau Kabur Suahasil memaparkan target untuk penanganan hak tagih BLBI pada 2025 adalah senilai Rp2 triliun, yang terdiri dari penerimaan negara bukan pajak (PNBP) ke kas negara Rp500 miliar, penguasaan fisik Rp500 miliar, dan penyitaan Rp1 triliun. Kemudian terhitung dari satgas tersebut dibentuk pada 2021 hingga 5 September 2024, telah terkumpul Rp38,88 triliun dari obligor/debitur yang memiliki utang ke negara. ""Capaian Satgas BLBI sekarang telah mencapai dalam berbagai macam bentuk Rp38,88 triliun per 5 September lalu,"" ujar Suahasil lebih lanjut. Realisasi terkumpul dalam berbagai macam bentuk yakni PNBP ke kas negara Rp1,84 triliun, sita/penyerahan barang jaminan Rp18,13 triliun, penguasaan aset properti Rp9,21 triliun, penetapan status penggunaan (PSP) dan hibah Rp5,93 triliun dan PMN non tunai Rp3,77 triliun. ""Ini berbagai macam kegiatan telah dilakukan dari investarisasi dokumen aset, pemanggilan debitur, pengelolaan barang jaminan yang dioptimalkan dengan pemblokiran penyitaan dan lelang, penerapan PP 28/2022 sebagai payung hukum pembatasan keperdataan,"" jelasnya. Capaian tersebut terbilang masih jauh dari target yang harus dikumpulkan yakni Rp110,45 triliun. Berarti masih ada sisa tagihan sebesar Rp71 triliun. Sedangkan masa tugas Satgas BLBI hanya sampai 31 Desember 2024 berdasarkan Keputusan Presiden (Keppres) Nomor 30 Tahun 2023. [Gambas:Video CNN] (del/pta)","Selasa, 10 Sep 2024 11:00 WIB",Ekonomi
"Kota Semarang, Penyelenggara Transportasi Terbaik se-Indonesia 2024","Kota Semarang menyabet Penghargaan Wahana Tata Nugraha (WTN) dari Kementerian Perhubungan Republik Indonesia Kategori Kota Raya terbaik se-Indonesia, mengalahkan kota-kota besar seperti Surabaya, Depok, Pekanbaru, Palembang, dan Bandung. Bagi Wali Kota Semarang Hevearita Gunaryanti Rahayu atau Mbak ita, penghargaan ini merupakan motivasi sekaligus tantangan bagi pemerintah dan warga untuk meningkatkan kualitas transportasi. Penghargaan diserahkan langsung oleh Menteri Perhubungan Budi Karya Sumadi, dan diterima oleh Plh. Sekretaris Daerah Kota Semarang, Mukhamad Khadik mewakili Mbak Ita pada acara Hub Space 2024, Sabtu (7/9) di JIExpo Kemayoran, Jakarta Pusat. ""Alhamdulillah, Kota Semarang meraih Penghargaan Wahana Tata Nugraha atas penyelenggaraan transportasi perkotaan. Kota Semarang menjadi yang terbaik se-Indonesia untuk kategori kota raya,"" ujar Mbak Ita. Selain menyampaikan terima kasih dan apresiasi kepada pihak-pihak yang telah berpartisipasi memajukan bidang transportasi di Semarang, Mbak Ita juga menyatakan bahwa kritik dan masukan masyarakat merupakan bahan evaluasi untuk mengoptimalkan kinerja di bidang transportasi. ""Terima kasih untuk teman-teman di Satlantas Polrestabes, Dinas Perhubungan, BRT atau Trans Semarang, dan dinas-dinas lainnya, juga warga masyarakat pengguna setia BRT atas kritik dan masukannya selama ini,"" kata Mbak Ita. Saat ini, Pemerintah Kota (Pemkot) Semarang terus berupaya meningkatkan kualitas dan kuantitas layanan transportasi umum. Upaya itu membuat Semarang ditunjuk pemerintah pusat sebagai kota kedua di Indonesia yang akan memiliki moda transportasi publik Autonomous Rail Rapid Transit (ART) setelah IKN. Transportasi ART menyerupai seperti trem, dengan menggunakan roda karet dan digerakkan oleh tenaga listrik. Beberapa waktu lalu telah dilakukan kajian dengan PT KAI terkait implementasi ATR. ""Mudah-mudahan semua lancar sehingga masyarakat Kota Semarang memiliki akses transportasi umum yang lebih bervariasi. Tentunya ini untuk meningkatkan kesejahteraan masyarakat,"" ujar Mbak Ita. (rea/rir) [Gambas:Video CNN]","Selasa, 10 Sep 2024 10:55 WIB",Ekonomi
"Kanal Pengaduan Semarang ""Sapa Mbak Ita"" Dapat Predikat Sangat Baik","Wali Kota Semarang, Hevearita Gunaryanti Rahayu (Mbak Ita) menyampaikan apresiasi terhadap kinerja Organisasi Perangkat Daerah (OPD) dalam merespons aduan masyarakat melalu kanal Sapa Mbak Ita, sejalan dengan hasil penilaian kinerja pengelolaan pengaduan Pemerintah Kabupaten/Kota tahun 2023 dari Kementerian Dalam Negeri yang menyatakan bahwa Kota Semarang mendapatkan predikat kualitas pengelolaan pengaduan ""sangat baik"". Berdasarkan hasil rekapitulasi laju tindak lanjut penilaian tersebut, pengelola pengaduan Kota Semarang mampu menyelesaikan laporan yang masuk melalui kanal sapambakita.lapor.go.id dengan jumlah aduan terkelola tertinggi kedua setelah Kota Malang dengan laju tindak lanjut 100 persen. Secara khusus, Mbak Ita menyatakan apresiasi terhadap seluruh admin penghubung Kanal Pengaduan Publik Sapa Mbak Ita yang bekerja selama 24 jam dalam 7 hari guna menangani berbagai lingkup aduan kemasyarakatan, mulai dari perbaikan fasilitas umum, perbaikan infrastruktur, pelayanan administrasi kependudukan, hingga fasilitas pendidikan. ""Saya atas nama pribadi dan Pemerintah Kota Semarang mengucapkan matur nuwun kepada teman-teman yang sudah sangat gercep untuk menerima dan menyelesaikan keluhan, masukan atau bahkan kritikan dari masyarakat. Terima kasih kepada semua tim yang terlibat dalam penyelesaian aduan masyarakat melalui kanal ini,"" ujar Mbak Ita dalam Rapat Monitoring dan Evaluasi Pelayanan Pengaduan ""Sapa Mbak Ita"" Catur Wulan II di Balai Kota Semarang, Kamis (5/9). Senada, Kepala Dinas Kominfo Kota Semarang, Soenarto, turut memuji kinerja admin pengelola kanal aduan publik Sapa Mbak Ita yang berjumlah lima kanal. Soenarto berharap, proses penyelesaian pengaduan dapat terus disempurnakan. ""Pertama, tentang bagaimana laporan yang selesai bersyarat dapat diselesaikan secepatnya. Kedua, tuntaskan aduan masyarakat hingga benar-benar selesai agar tidak terjadi laporan berulang. Ketiga, selesaikan aduan dengan memperhatikan kualitas tindak lanjutnya,"" papar Soenarto. Dalam Kegiatan Monitoring dan Evaluasi Pengaduan Pelayanan Publik Sapa Mbak Ita Caturwulan II Tahun 2024, para admin penghubung Pengelola Pengaduan Publik didorong untuk meningkatkan kualitas pelayanan, khususnya dalam merespon aduan dan aspirasi masyarakat. ""Laporan yang masuk harus segera dikonfirmasi untuk ditindaklanjuti. Untuk menindaklanjuti laporan tidak perlu meminta permohonan data pelapor, cukup fokus pada aduan yang dilaporkan,"" kata Soenarto. Monitoring dan evaluasi disebut akan dilakukan secara rutin oleh Dinas Kominfo Kota Semarang, sehingga kendala yang ada dapat teridentifikasi, sekaligus sebagai sarana bersilaturahmi antar admin penghubung, admin utama dan pengelola pengaduan. Di sepanjang catur wulan II dari Mei hingga Agustus, terdapat 1.598 aduan yang masuk ke kanal Sapa Mbak Ita. Pada periode yang sama, Dinas Perhubungan Kota Semarang menjadi OPD dengan jumlah disposisi tertinggi, sejumlah 297 aduan, disusul oleh Dinas Pekerjaan Umum 251 aduan, Dinas Perumahan dan Kawasan Permukiman 222 aduan, Satpol PP 116 aduan dan Dinas Kominfo 85 aduan. Adapun aduan terbanyak yang masuk pada catur wulan II adalah terkait laporan jalan rusak, aduan parkir, lampu PJU padam, aduan trantibum, dan permintaan pemangkasan pohon. (rea/rir) [Gambas:Video CNN]","Selasa, 10 Sep 2024 10:31 WIB",Ekonomi
Investor China-Australia Akan Groundbreaking Proyek Rp650 M di IKN,"Sejumlah investor asing akan melangsungkan prosesi peletakan batu pertama atau groundbreaking proyek di Ibu Kota Nusantara (IKN), Kalimantan Timur. Nilai investasinya diperkirakan mencapai Rp 650 miliar. Plt Wakil Kepala Otorita IKN, Raja Juli Antoni mengatakan ada dua investor asing yang akan melangsungkan groundbreaking. Mereka berasal dari China dan Australia. Untuk lingkup sektornya, ia mengatakan ada yang bergerak di properti dan ada yang di pendidikan. Gaji Pekerja Akan Dipotong Lagi untuk Program Pensiun Baru ""Ada dua investor asing yang akan groundbreaking. Pertama yaitu Delonix, ini sebuah perusahaan dari China yang akan membangun mal, hotel, apartemen,"" kata Raja Juli, ditemui usai Rapat Kerja (Raker) bersama Komisi II DPR RI di Senayan, Jakarta Pusat, Senin (9/9) seperti dikutip dari detik.com. Raja Juli mengatakan Delonix akan membangun kawasan mix-used di IKN. Ia memproyeksikan total investasi yang dikucurkan mencapai Rp 500 miliar. ""Jadi asing ada dua yang mau groundbreaking itu, Delonix Rp 500 miliar. Yang satu lagi, Australian Independent School, itu sekitar Rp 150 miliar,"" ujarnya. Di sisi lain, belum dapat dipastikan berapa jumlah investor swasta yang akan groundbreaking di IKN pada bulan September ini. Diperkirakan jumlahnya mencapai 6-8 investor, termasuk dua investor asing tersebut. Sedangkan saat ditanya kepastian tanggal pelaksanaan groundbreaking, Raja Juli belum dapat memastikannya. Meski begitu, menurutnya groundbreaking akan dilakukan saat Jokowi telah mulai berkantor di IKN. ""Belum, sedang dicocokkan dengan (jadwal) Presiden. Ya kira-kira setelah Pak Presiden akan kesana Kamis pagi, insyaallah beliau berangkat,"" kata dia. Sebelumnya Menteri Pekerjaan Umum dan Perumahan Rakyat (PUPR) sekaligus Plt Kepala Otorita IKN (OIKN) Basuki Hadimuljono membocorkan bahwa akan ada 7 investor yang groundbreaking proyeknya di IKN dalam waktu dekat ini. ""Ada 7 investor yang mau groundbreaking,"" kata Basuki, ditemui usai Rapat Kerja (Raker) bersama Komisi V DPR RI di Senayan, Jakarta beberapa waktu lalu. Basuki memaparkan, sektor-sektor dari ketujuh investor yang akan groundbreaking bulan depan meliputi pendidikan, hotel, properti, hingga pusat olah raga atau sport center. Namun demikian, ia belum dapat menaksir nilai investasi dari groundbreaking kali ini. Sedangkan untuk minat investasi sendiri lewat letter of intent (LOI), total ada 472. Dari jumlah tersebut, yang dikelompokan Basuki sebagai real investor dan berkemungkinan merealisasikan pembangunannya di IKN ada 220 LoI. ""Lainnya kontraktor, supplier, konsultan. 220 dievaluasi, ada 60 yang memang mau investasi. Dari 60 yang kemarin sudah 5 investasi. Bulan depan mudah-mudahan 7-8 lagi,"" ujarnya. Secara keseluruhan, IKN telah mengantongi investasi senilai Rp 56 triliun dari groundbreaking tahap 1-7 yang telah digelar. Sedangkan untuk dana APBN sendiri yang sudah diguyurkan ke IKN, lanjut Basuki, total ada sebanyak Rp 85 triliun. [Gambas:Video CNN] (agt/pta) [Gambas:Video CNN]","Selasa, 10 Sep 2024 10:30 WIB",Ekonomi
"Erick Thohir Tambah Jabatan di Bulog, Anak Buah Prabowo Jadi Wadirut","Menteri Badan Usaha Milik Negara (BUMN) Erick Thohir menambah posisi baru di Perum Bulog; wakil direktur utama. Jabatan ini sebelumnya tidak ada. Posisi baru ini diberikan kepada Marga Taufiq yang resmi diangkat pada Senin (9/9) melalui Keputusan Menteri BUMN Nomor SK-73/DHK.MBU.A/09/2024. Marga adalah anak buah Presiden terpilih Prabowo Subianto yang sebelumnya menjabat sebagai Staf Khusus Yayasan Pengembangan Potensi Sumber Daya Pertahanan (YPPSDP) Kementerian Pertahanan. Jauh sebelumnya, Marga juga pernah menjadi bawahan Prabowo saat sama-sama berada di Komando Strategi Angkatan Darat (Kostrad). Posisi itu ia tempati saat Prabowo menjadi Pangkostrad pada 1998. Copot Bayu Krisnamurthi, Erick Angkat Wahyu Suparyono Jadi Dirut Bulog Marga merupakan lulusan Akademi Militer cabang Infanteri pada 1987. Semasa perjalanan karir nya, ia juga tercatat pernah menjabat sebagai Wakil Komandan Pusat Teritorial Angkatan Darat dan Pangdam XVI/Pattimura Selain Marga, Erick juga mengangkat Wahyu Suparyono menjadi Direktur Utama Perum Bulog menggantikan posisi Bayu Krisnamurthi yang telah menyelesaikan pengabdiannya di perusahaan. Wahyu sebelumnya menjabat sebagai Direktur Utama Asabri. Ia juga pernah menduduki posisi Direktur Utama di PT Dok dan Perkapalan Kodja Bahari (Persero) pada 2017-2020, dan Direktur Utama di PT Perusahaan Perdagangan Indonesia pada 2014-2015. Selain itu, Erick juga Sudarsono Hardjosoekarto sebagai Direktur Human Capital menggantikan Purnomo Sinar Hadi. Sebelumnya ia merupakan Guru Besar Sosiologi dan Birokrat. Sudarsono juga pernah menjabat sebagai Direktur Jenderal Kesatuan Bangsa dan Politik Kementerian Dalam Negeri. [Gambas:Video CNN] (ldy/agt)","Selasa, 10 Sep 2024 09:57 WIB",Ekonomi
