judul,isi,tanggal,kategori
Maarten Paes 'Pelototi' Kemungkinan Permainan Fisik Australia,"Kiper andalan Timnas Indonesia, Maarten Paes, mewaspadai permainan fisik Timnas Australia jelang laga kedua Grup C ronde ketiga Kualifikasi Piala Dunia 2026 Zona Asia di Stadion Utama Gelora Bung Karno, Jakarta, Selasa (10/9) malam ini. Beberapa hari lalu, Maarten juga mengaku mewaspadai kemungkinan pergerakan winger Martin Boyle yang bisa membahayakan gawangnya. ""Kami tahu di laga nanti, Australia akan mengandalkan permainan fisik, dan kita harus waspada karena tentu mereka sedang lapar akan kemenangan. Dan kami harus bagus juga secara fisik,"" kata Maartendalam wawancara di Stadion Madya, kawasan GBK, Jakarta Pusat, Minggu (8/9). Pilihan Redaksi Bintang Australia Terbiasa dengan Pemain Indonesia Berdarah Belanda Sinyal Bagus bagi Indonesia, 2 Tuan Rumah Menang bersama Salman Falahi Bek Australia Tantang Suporter Timnas Indonesia di GBK Sementara itu, satu pemain yang ditandai Maarten adalah Martin Boyle yang menjadi winger Socceroos. Menurut Maarten, Boyle memiliki kecepatan, teknik individu yang mahir, dan umpan silang tajam yang pantas diwaspadai. Selain itu, kiper yang baru merasakan debut Timnas Indonesia itu mengaku ingin suporter Garuda dapat memberikan dukungan penuh dan maksimal di Stadion Gelora Bung Karno. Pemain FC Dallas itu pun mengaku antusias dengan chant suporter timnas Indonesia di SUGBK nanti malam. ""Saya berharap banyak pada fans, jujur, dari beberapa potongan video yang saya lihat, fans sangat luar biasa. Setelah main ada lagu Tanah Airku, SUGBK sangat luar biasa,"" ujar Maarten. Sinyal Bagus bagi Indonesia, 2 Tuan Rumah Menang bersama Salman Falahi Saat ini, Indonesia di posisi keempat klasemen sementara Grup C dengan 1 poin dari 1 laga. Di atasnya ada Jepang (3 poin), Bahrain (3 poin), dan Arab Saudi (1 poin). Posisi bawah alias peringkat 5 dan 6 ada Australia dan China. (tim/kid)","Selasa, 10 Sep 2024 14:55 WIB",Olahraga
FOTO: 1.966 Anak Rintis Mimpi Juara Dunia Lewat Audisi Umum PB Djarum,Audisi Umum PB Djarum 2024 yang dibuka pada Selasa (10/9) diikuti oleh 1.966 peserta. Mereka mulai merintis mimpi jadi juara dunia. :,"Selasa, 10 Sep 2024 14:35 WIB",Olahraga
"Rapor STY Lawan Australia, Tidak Inferior","Pelatih Timnas Indonesia Shin Tae Yong memiliki rapor yang terbilang baik saat bersua Australia jelang laga babak ketiga Kualifikasi Piala Dunia 2026, Selasa (10/9). Berdasarkan data Transfermarkt, Shin Tae Yong tercatat enam kali pernah mendampingi anak asuhnya melawan Australia. Empat pertandingan bersama Indonesia dan dua pertandingan ketika masih bersama Korea Selatan. Dari enam pertemuan itu, Shin Tae Yong hanya satu kali berstatus pelatih timnas senior. Lima lainnya terjadi ketika menukangi timnas kelompok umur. Pilihan Redaksi Reaksi Calvin Verdonk Usai Followers Instagram Tembus 1 Juta Wasit Kontroversial Salman Falahi Pimpin Laga Indonesia vs Australia Prediksi Timnas Indonesia vs Australia di Kualifikasi Piala Dunia STY pertama kali menghadapi Australia U-23 dalam laga uji coba bersama Korsel U-22 pada 9 Oktober 2015. Hasilnya, Korsel U-22 berhasil meraih kemenangan dengan skor 2-0 di Stadion Hwaseong. Korsel U-22 kembali beruji coba dengan Australia U-23 hanya tiga hari berselang. Kemenangan kembali mampu diamankan, kali ini dengan skor tipis 2-1. Setelah itu, STY baru kembali bertemu lagi di Australia tahun 2021. Pelatih berusia 53 tahun itu tengah menukangi Timnas Indonesia U-23. STY bersama Timnas U-23 harus mengakui keunggulan Australia U-23 dalam dua pertemuan di Kualifikasi Piala Asia U-23 2022. Dalam laga yang digelar di Dushanbe, Tajikistan, Garuda Muda takluk 2-3 dan 0-1 sehingga gagal lolos ke putaran final. Kekalahan kembali terjadi saat memimpin Timnas Indonesia di Piala Asia 2023. Tim Merah Putih takluk 0-3 dari Australia di babak 16 besar. Namun, rentetan kekalahan itu bisa diputus di Piala Asia U-23 2024. Kali ini, STY berhasil membawa Rafael Struick dan kawan-kawan mengalahkan Australia 1-0 di fase grup. [Gambas:Video CNN] (jal/sry)","Selasa, 10 Sep 2024 14:14 WIB",Olahraga
Pelatih Pau Marti Buka Suara Soal Calon Pemain Naturalisasi Malaysia,"Pelatih Pau Marti Vicente buka suara terkait rumor calon pemain naturalisasi baru untuk timnas Malaysia usai juara Pestabola Merdeka 2024. Malaysia kembali juara Pestabola Merdeka setelah mengalahkan Lebanon 1-0 di Stadion Bukit Jalil, akhir pekan lalu. Gelar juara tersebut jadi yang ke-13 bagi Malaysia di turnamen Pestabola Merdeka. Sebelum laga tersebut muncul isu kapten klub Liga Inggris Burnley, Josh Brownhill, berminat jadi pemain naturalisasi timnas Malaysia. Pilihan Redaksi Momen Timnas Indonesia Hajar Australia 1-0 di Kualifikasi Piala Dunia Prediksi Timnas Indonesia vs Australia di Kualifikasi Piala Dunia Perbandingan Ranking FIFA Timnas Indonesia vs Australia Selain Josh Brownhill, pemain muda PSV Eindhoven Iggy Houben juga dikabarkan tertarik berkostum Malaysia. Ada juga bek klub Belanda lain, Go Ahead Eagles, Mats Deijl. Isu itu makin kencang usai Malaysia juara Pestabola Merdeka 2024. Meski begitu, terkait rumor pemain naturalisasi baru, pelatih Pau Marti Vicente mencoba tetap tenang. Pelatih asal Spanyol itu mengatakan hanya fokus pada pemain yang ada saat ini. ""Saya rasa kami perlu melihat dulu dan saya rasa sulit untuk mengomentari pemain yang tidak ada di sini, jadi jika sesuatu terjadi dan setelah dikonfirmasi barulah kami dapat berbicara tentang mereka,"" ujar Pau Marti dikutip Sinar Daily. Pau Marti mengaku senang dengan kualitas pemain Malaysia saat ini. Apabila kedatangan pemain baru, maka setiap pemain harus berlomba-lomba menunjukkan kualitas. ""Saya rasa untuk saat ini kami memiliki banyak pemain, pemanggilan ini sulit bagi saya karena hampir semua pemain cocok dengan klub, jadi kami harus memutuskan dengan sangat baik, saya sangat senang dengan kualitas yang kami miliki dan jika lebih banyak pemain datang maka mereka harus berjuang untuk mendapatkan tempat,"" kata Vicente. Pau Marti tidak menutup diri soal tambahan pemain naturalisasi atau keturunan. Hanya saja, apabila datang pemain keturunan baru, maka kan jadi tugas berat dalam melakukan seleksi. ""Saya pikir dunia saat ini sedang bekerja, akan ada lebih banyak campuran di setiap negara, dari sisi pelatih, jika para pemain memenuhi syarat untuk bermain bagi negara tersebut, maka kita perlu menilai dan melihat apakah mereka cukup baik untuk menjadi bagian dari tim,"" tutur Pau Marti. [Gambas:Video CNN] (sry/nva)","Selasa, 10 Sep 2024 13:46 WIB",Olahraga
Link Live Streaming Bhayangkara vs Pavlodar di AVC Men's Club 2024,"AVC Men's Club Volleyball Championsip 2024 yang berlangsung di Iran akan kembali menampilkan laga Bhayangkara Presisi menghadapi Pavlodar VC siang ini, Selasa (10/9). Berikut link live streaming Bhayangkara vs Pavlodar di AVC Men's Club. Duel antara perwakilan dari Indonesia dan Khazakstan ini akan digelar di Shahediyeh Indoor Stadium, Yazd, Iran, dan disiarkan langsung oleh stasiun televisi Moji pada pukul 14.00 WIB. Sementara link live streaming Bhayangkara vs Pavlodar dalam laga AVC Men's Club Volleyball Championship 2024 juga dapat disaksikan melalui live streaming Video.com. Pilihan Redaksi Wasit Kontroversial Salman Falahi Pimpin Laga Indonesia vs Australia Prediksi Timnas Indonesia vs Australia di Kualifikasi Piala Dunia Prediksi Line Up Indonesia vs Australia di Kualifikasi Piala Dunia Laga pemungkas di Grup A ini tidak menentukan peluang lolos atau tidaknya kedua tim ke babak selanjutnya. Pasalnya, baik Bhayangkara Presisi maupun Pavlodar VC sudah memastikan satu tiket di babak perempat final. Hasil dari pertandingan siang ini hanya untuk memastikan calon lawan yang akan dihadapi kedua tim di babak perempat final. Bhayangkara Presisi saat ini menempati posisi Runner-up di bawah tuan rumah Shahdab Yazd. Sedangkan Pavlodar VC menempati peringkat ketiga di Grup A. Apabila setelah pertandingan siang ini Bhayangkara Presisi masih menempati posisi runner-up Grup A, mereka akan melakoni laga di babak berikutnya menghadapi peringkat tiga Grup B, antara Gas Al Janoob dari Irak atau Al Rayyan dari Qatar. Kedua klub asal Timur Tengah itu pun bakal menjadi lawan bagi Nizar Julfikar dan kawan-kawan bila turun ke peringkat ketiga. Partai siang ini diprediksi akan berlangsung sengit dan alot, lantaran kedua tim memiliki kekuatan yang merata. Mereka sama-sama menang menghadapi Kuwait SC dan sama-sama kalah dari tim tuan rumah, Shahdab Yazd. Link Live Streaming Bhayangkara vs Pavlodar di AVC Men's Club Volleyball Championship 2024: Shahediyeh Indoor Stadium, Yazd, Iran / Moji/ Selasa (10/9) pukul 14.00 WIB [Gambas:Video CNN] (afr/nva)","Selasa, 10 Sep 2024 13:21 WIB",Olahraga
FOTO: Kembang Api Pembukaan PON XXI Aceh-Sumut 2024,"Pekan Olahraga Nasional (PON) XXI Aceh-Sumatera Utara 2024 resmi dibuka pada 9 September, bertepatan dengan Hari Olahraga Nasional. :","Selasa, 10 Sep 2024 13:12 WIB",Olahraga
"Sinyal Bagus bagi Indonesia, 2 Tuan Rumah Menang bersama Salman Falahi","Kepemimpinan wasit kontroversial Salman Ahmad Falahi bisa memberikan hasil positif bagi Timnas Indonesia saat lawan Australia dalam Kualifikasi Piala Dunia 2026, Selasa (10/9). Timnas Indonesia menjamu Australia dalam laga kedua Grup C babak ketiga Kualifikasi Piala Dunia 2026 di Stadion Utama Gelora Bung Karno (GBK). Pertandingan ini jadi laga kandang pertama Indonesia dalam babak ketiga Kualifikasi Piala Dunia 2026. Laga tersebut akan dipimpin wasit asal Qatar, Salman Ahmad Falahi. Salman Falahi sendiri terkenal cukup kontroversial di mata penggemar Indonesia. Pilihan Redaksi Momen Timnas Indonesia Hajar Australia 1-0 di Kualifikasi Piala Dunia Reaksi Calvin Verdonk Usai Followers Instagram Tembus 1 Juta Prediksi Timnas Indonesia vs Australia di Kualifikasi Piala Dunia Wasit 34 tahun ini dianggap terlibat dalam gol kontroversial Osama Rashid yang membawa Irak unggul 2-1 atas Timnas Indonesia dalam babak pertama di Piala Asia 2023. Pada akhirnya Indonesia kalah 1-3 dari Irak di Piala Asia. Salman Falahi juga pernah dapat kesempatan jadi wasit di multievent SEA Games 2019. Dalam ajang tersebut pelatih Vietnam saat itu Park Hang Seo mengamuk kepada Salman Falahi karena keputusan kontroversialnya. Meski begitu, Vietnam menang 4-0 atas Kamboja dan lolos ke final SEA Games 2019. Meski begitu, di antara kontroversi Salman Falahi, Timnas Indonesia tetap bisa mendapatkan hasil positif saat menghadapi The Socceroos. Situs Transfermarkt mencatat Salman Faalahi sudah memimpin pertandingan Kualifikasi Piala Dunia 2026 sebanyak tiga kali. Dua dari tiga tuan rumah yang dipimpin Salman Falahi meraih kemenangan. Timnas Indonesia jadi salah satu tim yang menang saat dipimpin Salman, yakni saat menggulung Vietnam 1-0 di GBK, Maret lalu. Korea Utara juga menang 1-0 atas Suriah pada Juni lalu. Hanya Thailand, tuan rumah yang gagal menang saat Salman jadi wasit utama. Pada November 2023, Thailand kalah 1-2 dari China. Rapor Salman Ahmad Falahi itu diharapkan berlanjut saat Timnas Indonesia menjamu Australia di GBK. Tim Merah Putih bertekad melanjutkan tren positif dalam Kualifikasi Piala Dunia 2026. [Gambas:Video CNN] (sry/jal)","Selasa, 10 Sep 2024 12:36 WIB",Olahraga
Bek Australia Tantang Suporter Timnas Indonesia di GBK,"Pemain belakang Australia Alessandro Circati menantang suporter Indonesia di Stadion Utama Gelora Bung Karno (GBK) jelang melawan Timnas Indonesia, Selasa (10/9). Timnas Indonesia menjamu Australia dalam laga kedua Grup C babak ketiga Kualifikasi Piala Dunia 2026 di Stadion Utama Gelora Bung Karno (GBK). Pertandingan ini jadi laga kandang pertama Indonesia dalam babak ketiga Kualifikasi Piala Dunia 2026. Fanatisme suporter Indonesia sampai ke telinga The Socceroos. Fans Indonesia dipercaya akan memberikan intimidasi tiada henti kepada Australia. Pilihan Redaksi Momen Timnas Indonesia Hajar Australia 1-0 di Kualifikasi Piala Dunia Reaksi Calvin Verdonk Usai Followers Instagram Tembus 1 Juta Prediksi Timnas Indonesia vs Australia di Kualifikasi Piala Dunia PSSI menjual sekitar 70 ribu tiket dari total kapasitas 78 ribu penonton di GBK untuk laga Indonesia vs Australia. Kendati Skuad Garuda akan dapat dukungan penuh dari suporter, namun Alessandro Circati akan membuktikan gemuruh 70 ribu penonton tidak memberikan efek bagi Australia. ""[Tekanan fans Indonesia] itu memompa semangat saya. Membuat saya semakin ingin menang, melawan semua penggemar yang mungkin menentang Anda, hanya untuk membuktikan bahwa mereka salah dan benar-benar menunjukkan kepada mereka bahwa 70.000 orang tidak membuat perbedaan pada cara saya bermain,"" ujar Circati dikutip dari Socceroos. Pemain asal klub Parma ini akan mengubah pemikiran itu menjadikan tekanan suporter di GBK sebagai penyemangat Australia. ""Saya pikir lingkungan yang tidak bersahabat ini seharusnya hanya membakar semangat Anda, saya tidak menganggapnya sebagai permusuhan,"" kata Circati. ""Saya pikir itu seharusnya menjadi energi untuk menyalakan semangat Anda. Itu seharusnya membuat Anda terus maju,"" tutur Circati menambahkan. (sry/jal)","Selasa, 10 Sep 2024 12:16 WIB",Olahraga
Prediksi Line Up Indonesia vs Australia di Kualifikasi Piala Dunia,"Timnas Indonesia akan bersua Australia pada laga kedua Grup C babak ketiga Kualifikasi Piala Dunia 2026. Berikut prediksi line up Indonesia vs Australia. Pelatih Timnas Indonesia Shin Tae Yong diperkirakan akan tetap memakai skema favorit 3-4-3 di laga ini. Di bawah mistar sosok Maarten Paes akan tetap jadi andalan. Kiper FC Dallas itu tetap jadi pilihan utama setelah debut apik ketika tim Garuda menahan Arab Saudi. Pilihan Redaksi 7 Fakta Menarik Jelang Timnas Indonesia vs Australia Reaksi Calvin Verdonk Usai Followers Instagram Tembus 1 Juta Prediksi Timnas Indonesia vs Australia di Kualifikasi Piala Dunia Trio di jantung pertahanan akan mengalami perubahan. Rizky Ridho, Jay Idzes, dan Justin Hubner akan dimainkan sejak menit pertama. Hubner yang sudah bebas dari sanksi akumulasi kartu kuning akan menggantikan posisi Calvin Verdonk. Posisi sayap kanan untuk laga ini akan ditempati oleh Asnawi Mangkualam. Pemain Port FC itu akan ditemani Thom Haye, Ivar Jenner, dan Verdonk yang mengisi posisi sayap kiri Tim Merah Putih. Thom Haye tidak bermain penuh saat meladeni Arab Saudi. Namun, mantan pemain Heerenveen itu diperkirakan akan tetap siap bermain sejak menit pertama. Sedangkan Verdonk akan menggantikan peran Nathan Tjoe-A-On yang dimainkan sebagai starter saat melawan Arab Saudi. Di lini depan, sosok Ragnar Oratmangoen akan tetap jadi andalan di lini depan. Ia akan mendapatkan dukungan dari Witan Sulaeman dan Rafael Struick yang performanya tergolong baik saat bersua Arab Saudi. Prediksi susunan pemain Timnas Indonesia vs Australia: 3-4-3 Maarten Paes; Rizky Ridho, Jay Idzes, Justin Hubner; Asnawi Mangkualam, Thom Haye, Ivar Jenner, Calvin Verdonk; Witan Sulaeman, Rafael Struick, Ragnar Oratmangoen [Gambas:Video CNN] (jal/sry)","Selasa, 10 Sep 2024 11:50 WIB",Olahraga
Bintang Australia Terbiasa dengan Pemain Indonesia Berdarah Belanda,"Gelandang Australia Aziz Behich buka-bukaan bicara soal pengaruh pemain berdarah Belanda yang kini membela Timnas Indonesia jelang duel Kualifikasi Piala Dunia 2026, Selasa (10/9). Timnas Indonesia menjamu Australia dalam laga kedua Grup C babak ketiga Kualifikasi Piala Dunia 2026 di Stadion Utama Gelora Bung Karno (GBK). Pertandingan nanti krusial bagi Indonesia yang ingin melanjutkan tren positif dalam Kualifikasi Piala Dunia 2026 ini. Pilihan Redaksi Momen Timnas Indonesia Hajar Australia 1-0 di Kualifikasi Piala Dunia Reaksi Calvin Verdonk Usai Followers Instagram Tembus 1 Juta Jadwal Siaran Langsung Timnas Indonesia vs Australia Menjelang laga tersebut, pelatih Aziz Behich menyinggung soal pemain naturalisasi Indonesia yang mayoritas memiliki darah Belanda. Sepanjang kariernya sebagai pemain, Aziz Behich pernah bermain di Belanda, yakni bermain di PSV Eindhoven selama satu musim. Terlebih lagi Aziz Behich juga bermain penuh selama 90 menit saat Australia menang 4-0 atas Timnas Indonesia di babak 16 besar Piala Asia 2023. Saat itu empat pemain keturunan Indonesia-Belanda dimainkan pelatih Shin Tae Yong. ""Ya, saya memang pernah bermain di Belanda, sudah pernah juga bermain dengan para pemain Belanda,"" ujar Behich dalam konferensi pers jelang laga. ""Tapi menurut saya, mereka (pemain keturunan) ini tetaplah orang Indonesia. Jadi mereka tetap pemain Indonesia,"" ucap Behich menambahkan. Sementara itu pelatih Australia Graham Arnold mengakui Timnas Indonesia memiliki perkembangan sejak Piala Asia 2023. Meski begitu, Australia di mata Arnold siap memberikan pelajaran kepada Skuad Garuda. ""Kami sudah bermain melawan Indonesia di Piala Asia 2023, kami menang 4-0. Kami juga sudah pernah menonton (pertandingan) mereka, sudah riset soal mereka,"" kata Arnold. ""Timnas U-23 mereka bahkan masuk ke play-off Olimpiade. Permainan mereka memang berkembang, tapi para pemain kami juga sudah bersiap, kami hanya akan fokus pada diri kami dan bagaimana kami tampil."" [Gambas:Video CNN] (abs/jal)","Selasa, 10 Sep 2024 11:27 WIB",Olahraga
Pelatih Australia Bicara Soal Tekanan Main di GBK Lawan Indonesia,"Pelatih Australia Graham Arnold mengakui akan merasakan tekanan dari suporter Timnas Indonesia saat bertanding di Stadion Utama Gelora Bung Karno pada babak ketiga Kualifikasi Piala Dunia 2026, Selasa (10/9). Namun, Arnold mengaku tidak terlalu risau mengenai hal ini. Pelatih berusia 61 tahun itu mengatakan anak asuhnya sudah punya pengalaman bermain di stadion yang didominasi pendukung tuan rumah. ""Soal penonton, saya pikir Indonesia sebagai tuan rumah akan mendapat dukungan dari suporter dan itu bisa memberi tekanan bagi performa kami,"" ujar Arnold saat sesi konferensi pers jelang laga di Jakarta, Senin (9/9). Pilihan Redaksi 7 Fakta Menarik Jelang Timnas Indonesia vs Australia Reaksi Calvin Verdonk Usai Followers Instagram Tembus 1 Juta Timnas Indonesia vs Australia: Saatnya Ulang Kisah 43 Tahun Silam ""Tetapi terkait atmosfer itu, bisa saja berdampak ke dua tim, baik tim kandang mau tandang. Kami sudah punya pengalaman tampil di stadion besar dengan pendukung tuan rumah yang banyak,"" katanya menambahkan. Australia memang bukan hanya akan menghadapi Timnas Indonesia. Socceroos, julukan Australia, juga akan menghadapi tekanan yang datang dari suporter tim Merah Putih di Stadion GBK. Lautan merah dipastikan akan terjadi di tribune penonton. Ini karena sekitar 65 ribu tiket yang disediakan untuk pertandingan Timnas Indonesia vs Australia telah ludes terjual sejak Minggu (8/9). ""Tiket semua kategori sudah ludes terjual,"" demikian unggahan Instagram resmi Timnas Indonesia. Timnas Indonesia bertekad melanjutkan tren positif di laga kedua ini setelah menahan imbang Arab Saudi di laga tandang pada babak ketiga Kualifikasi Piala Dunia 2026. Sementara Australia bertekad untuk bangkit usai di luar dugaan takluk 0-1 dari Bahrain saat bermain di kandang. [Gambas:Video CNN] (abs/jal)","Selasa, 10 Sep 2024 11:05 WIB",Olahraga
12 Atlet dan Ofisial IKN Perdana Ikut Defile Pembukaan PON 2024,"Pekan Olahraga Nasional (PON) XXI Aceh-Sumut resmi dibuka oleh Presiden Joko Widodo di Stadion Harapan Bangsa, Banda Aceh, Senin (9/9). Pembukaan PON XXI ini beriringan dengan puncak pelaksanaan hari olahraga nasional. Saat parade kontingen atau defile dari 39 Provinsi, ada satu defile tambahan yaitu dari Otorita Ibu Kota Nusantara (IKN). IKN mengirim 12 atlet dan ofisial. Saat defile mereka menggunakan pakaian adat dari berbagai provinsi. Kontingen ini berjalan di urutan ketiga terakhir sebelum tuan rumah Aceh dan Sumut. Pilihan Redaksi 7 Fakta Menarik Jelang Timnas Indonesia vs Australia Reaksi Calvin Verdonk Usai Followers Instagram Tembus 1 Juta Prediksi Timnas Indonesia vs Australia di Kualifikasi Piala Dunia Pantauan CNNIndonesia.com, saat dipanggil oleh pembawa acara tampak Presiden Joko Widodo dan Iriana melambaikan tangan ke arah kontingen IKN. Keikutsertaan IKN juga disampaikan oleh Pj Gubernur Aceh, Safrizal. Kata dia ada 39 kontingen atlet dan ofisial dari seluruh provinsi di Indonesia plus otorita IKN. ""Selamat datang para atlet ofisial dari 39 provinsi seluruh Indonesia plus otorita IKN,"" kata Safrizal dalam sambutannya. Dari data yang dihimpun, atlet dari kontingen IKN berlaga dalam cabang olahraga senam, panahan, layar dan renang. Ini pertama kalinya kontingen IKN ikut serta dalam pesta olahraga multi-event secara nasional. Diketahui PON 2024 melombakan 65 cabang olahraga dan 1.042 nomor pertandingan yang dipertandingkan di 20 kabupaten/kota di Aceh dan Sumut. Pertandingan tersebut sebagian sudah di mulai sejak akhir Agustus lalu dan akan berakhir pada 20 September dan ditutup di Provinsi Sumatera Utara. Presiden Jokowi dalam arahannya mengatakan agar PON ini dijadikan ajang untuk melahirkan atlet-atlet terbaik dan mencetak calon peraih emas di level Internasional. ""Tapi yang juga tidak kalah penting olahraga ini juga ajang untuk mempererat persatuan kita, memperkokoh tali persaudaraan kita sebagai sebuah bangsa. Oleh sebab itu saya titip betul jaga sportivitas dan fair play,"" ujarnya. [Gambas:Video CNN] (jal)","Selasa, 10 Sep 2024 10:44 WIB",Olahraga
Audisi Umum PB Djarum 2024 Resmi Dimulai,"Audisi Umum PB Djarum 2024 resmi dimulai pada Selasa (10/9). Audisi Umum PB Djarum ini diikuti oleh 1.966 peserta. Minat besar diperlihatkan anak-anak Indonesia usia di bawah 12 tahun dalam mengikuti Audisi Umum PB Djarum 2024. Sejak pukul 07.00 WIB, GOR Bulu Tangkis PB Djarum di Jati, Kudus sudah dipenuhi ribuan peserta. Tercatat ada 2.548 peserta yang mendaftar dengan 1.966 peserta melakukan daftar ulang. Anak-anak begitu antusias dan tertib mengikuti proses alur masuk menuju lapangan. Setelah itu, para peserta berkumpul di lapangan untuk menyanyikan lagu Indonesia Raya terlebih dulu. Pilihan Redaksi Momen Timnas Indonesia Hajar Australia 1-0 di Kualifikasi Piala Dunia Prediksi Timnas Indonesia vs Australia di Kualifikasi Piala Dunia Perbandingan Ranking FIFA Timnas Indonesia vs Australia ""Hari ini adik-adik mengikuti Audisi Umum PB Djarum 2024. Pemanasan yang baik, yang cukup, sehingga saat bertanding nantinya kalian bisa mengeluarkan kemampuan maksimal."" ""Sehingga kami bisa melihat potensi maksimal pada diri adik-adik semua,"" ucap Sigit Budiarto, Legenda Indonesia asal PB Djarum yang juga Koordinator Tim Pencari Bakat Audisi Umum PB Djarum. Audisi Umum PB Djarum 2024 ini dimulai dengan tahapan screening. Tiap peserta akan bertanding satu sama lain dalam satu gim. Pemenang yang lebih dulu mencapai poin 21 akan lolos ke babak berikutnya. Setelah lewat tahap screening, barulah peserta yang tersaring mengikuti fase turnamen. Fase turnamen untuk kelompok putra dimulai dari babak 64 besar sedangkan untuk kelompok putri dimulai dari 32 besar. Empat peserta yang masuk semifinal di masing-masing kelompok untuk kategori putra akan mendapatkan Super Tiket untuk masuk tahap karantina. Sedangkan untuk kategori putri, peserta yang masuk final di masing-masing kategori yang akan mendapat super tiket untuk masuk tahap karantina. Selain itu, Tim Pencari Bakat juga punya wewenang untuk memberikan Super Tiket kepada peserta yang dinilai punya kemampuan dan kualitas. Audisi Umum PB Djarum 2024 berlangsung pada 10-14 September 2024. [Gambas:Video CNN] (ptr/jal)","Selasa, 10 Sep 2024 10:22 WIB",Olahraga
Perbandingan Ranking FIFA Timnas Indonesia vs Australia,"Timnas Indonesia dan Australia memiliki perbedaan ranking FIFA yang luar biasa menjelang duel kedua tim dalam babak ketiga Kualifikasi Piala Dunia 2026, Selasa (10/9). Timnas Indonesia menjamu Australia dalam laga kedua Grup C babak ketiga Kualifikasi Piala Dunia 2026 di Stadion Utama Gelora Bung Karno (GBK). Pertandingan ini jadi laga kandang pertama Indonesia dalam babak ketiga Kualifikasi Piala Dunia 2026. Baik Indonesia maupun Australia sama-sama mengincar hasil positif. Hanya saja, setelah dihajar Bahrain 0-1 dalam laga kandang, Australia bertekad menekuk Indonesia di kandangnya sendiri. Pilihan Redaksi Momen Timnas Indonesia Hajar Australia 1-0 di Kualifikasi Piala Dunia Profil Salman Falahi, Wasit Kontroversial di Indonesia vs Australia Gelora 10 November, Saksi Timnas Indonesia Tumpas Australia 1-0 Indonesia yang mengimbangi Arab Saudi 1-1 dalam pertandingan pertama juga berhasrat menang atas Australia. Akan tetapi, dengan melihat perbedaan ranking FIFA yang mencengangkan, hasil imbang sangat bagus untuk Skuad Garuda. Sebelum babak ketiga Kualifikasi Piala Dunia 2026 dimulai, Timnas Indonesia menempati peringkat ke-133 dalam ranking FIFA, berdasarkan rilis terakhir pada 18 Juli. Sementara, Australia unggul jauh atas Indonesia. The Socceroos unggul 109 setrip di atas Tim Merah Putih dengan menempati peringkat ke-24 dunia. Di level Asia, Australia menempati posisi keempat di bawah Jepang, Iran, dan Korea Selatan. Sedangkan Indonesia di peringkat ke-23 Asia. Pelatih Indonesia Shin Tae Yong mengakui perbedaan ranking membuat Australia layak lebih diunggulkan atas Indonesia. Meski begitu Jay Idzes dan kawan-kawan akan memberikan perlawanan kepada Australia. ""Saya tidak bisa bicarakan taktik di sini, tetapi kita bisa lihat dari FIFA ranking, kita mau menyerang pun pasti (ujung-ujungnya) akan lebih banyak bertahan,"" ujar Shin Tae Yong dalam konferensi pers jelang laga. ""FIFA ranking Australia 20-an, kita 130-an, mungkin saja 6:4. Tapi saya sebagai pelatih Timnas Indonesia bagaimana pun akan memikirkan (solusi) untuk itu,"" ucap Shin Tae Yong menambahkan. [Gambas:Video CNN] (sry/abs/jal)","Selasa, 10 Sep 2024 10:03 WIB",Olahraga
