judul,isi,tanggal,kategori
IHSG Berpeluang Menguat Hari Ini,"Indeks harga saham gabungan (IHSG) diproyeksi menguat pada perdagangan Selasa (10/9). CEO Yugen Bertumbuh Sekuritas William Surya Wijaya menilai di tengah minimnya sentimen domestik, IHSG masih akan bergerak dalam rentang konsolidasi wajar. Indeks, menurut Yugen, terus berusaha untuk dapat bertahan sembari menanti rilis data kinerja emiten yang diperkirakan dapat kembali mendongkrak kenaikan. ""Diperkirakan di Oktober, peluang koreksi jika terjadi masih dapat dimanfaatkan oleh investor untuk melakukan akumulasi pembelian terutama untuk saham saham berfundamental kuat dengan market kapitalisasi besar, hari ini IHSG berpotensi naik,"" ujar William dalam riset hariannya. Profil Marimutu Sinivasan, Buron BLBI yang Ditangkap Saat Mau Kabur Ia memprediksi pasar saham bergerak dalam rentang support 7.606 dan resistance 7.767 hari ini. Selanjutnya, William merekomendasikan sejumlah saham di antaranya ASII, TLKM, BBRI, ASRI, PWON, SMRA, KLBF, TBIG, BBCA, dan UNVR. Sementara itu, Head of Customer Literation & Education Kiwoom Sekuritas Oktavianus Audi menilai pergerakan IHSG masih akan dibayangi oleh investor yang menunggu rilis data inflasi AS. Pasalnya, hal itu akan menentukan sikap Bank Sentra AS The Federal Reserves (The Fed) ke depan. ""Kami perkirakan IHSG akan bergerak mixed cenderung melemah terbatas dalam rentang level support 7.647 dan resistance 7.765 dengan indikator MACD menunjukkan tren yang melandai,"" ujarnya kepada CNNIndonesia.com. Selain itu, Audi juga melihat pelemahan harga komoditas energi, seperti minyak mentah, semakin menunjukkan permintaan yang melemah dan ketidakpastian ekonomi yang meningkat. Hal-hal tersebut, menurut Audi, juga akan memengaruhi pergerakan IHSG. IHSG ditutup di level 7.702 pada Senin (9/9) sore. Indeks saham melemah 19,1 poin atau minus 0,25 persen dari perdagangan sebelumnya. Mengutip RTI Infokom, investor melakukan transaksi sebesar Rp10,71 triliun dengan jumlah saham yang diperdagangkan sebanyak 18,61 miliar saham. [Gambas:Video CNN] (ldy/sfr)","Selasa, 10 Sep 2024 06:15 WIB",Ekonomi
Kemenkeu Klaim APBN Hemat Rp1.398 T Berkat Sederhanakan Satker,"Wakil Menteri Keuangan II Thomas Djiwandono mengungkap penyederhanaan satuan kerja (satker) telah berhasil menghemat belanja negara hingga Rp1.398 triliun sejak 2019 hingga 2024. Penghematan tersebut utamanya berasal dari honor operasional satker. Thomas mengatakan penyederhanaan jumlah satker menjadi salah satu upaya Kementerian Keuangan dalam meningkatkan kualitas belanja negara melalui penajaman perumusan output alias hasil keluaran integrasi sistem dan pengendalian belanja. ""Sampai dengan tahun 2024 telah dilakukan penyederhanaan satker yang berimplikasi pada penurunan biaya operasional, salah satunnya dari honor operasional satuan kerja sebesar Rp1.398 triliun,"" tutur keponakan Presiden Terpilih Prabowo Subianto itu dalam Rapat Kerja bersama Komisi XI DPR RI, Senin (9/9). Selain penyederhanaan satker, perbaikan norma standar biaya masukan dan pengendalian biaya melalui standardisasi indeks biaya juga menjadi upaya lainnya untuk mencapai belanja negara yang lebih berkualitas. Profil Marimutu Sinivasan, Buron BLBI yang Ditangkap Saat Mau Kabur Upaya yang telah dilakukan Kemenkeu untuk meningkatkan kualitas belanja negara termasuk melalui akselerasi dan implementasi Peraturan Pemerintah (PP) Nomor 6 Tahun 2024 tentang Perubahan Ketiga Belas Atas PP Nomor 28 Tahun 2001 tentang Peraturan Gaji Anggota Tentara Nasional Indonesia. Selain itu, peningkatan jumlah output yang sudah menggunakan standar biaya keluaran serta perluasan sinkronisasi belanja pemerintah pusat dan daerah. ""Peningkatan jumlah output yang sudah menggunakan standar biaya keluaran, perluasan sinkronisasi belanja pemerintah pusat dan transfer ke daerah pada DAK nonfisik, dana otsus, dana insentif daerah, dan penyederhanaan jumlah satker,"" ujar Thomas lebih lanjut. Dengan berbagai upaya itu, dia menyebut pihaknya menargetkan indeks kualitas belanja pemerintah pusat dan daerah sebesar 84, perluasan implementasi standar keluaran khusus 5.117 output dan penurunan belanja birokrasi. ""Dan untuk mencapai target-target tersebut, membutuhkan alokasi sebesar Rp9,65 miliar,"" tutur dia. Menurut dia, anggaran tersebut digunakan untuk penajaman rumusan output melalui panduan penyusunan dan penggunaan klasifikasi rincian output (KRO) dan rincian output (RO), pengendalian belanja terutama belanja birokrasi melalui penetapan standardisasi biaya, dan peningkatan kemampuan SDM yaitu petugas yang menyusun rencana kerja dan anggaran (RKA). [Gambas:Video CNN] (del/pta)","Selasa, 10 Sep 2024 05:30 WIB",Ekonomi
Bank Jateng Raih Penghargaan 7 Most Popular Brand of The Year 2024,"Bank Jateng kembali menorehkan prestasi membanggakan. Dalam ajang bergengsi Jawa Pos 7 Most Popular Brand of The Year 2024, Bank Jateng berhasil meraih penghargaan sebagai merek paling populer dalam kategori keuangan (perbankan daerah). Acara penganugerahan yang berlangsung meriah di Balai Kartini, Jakarta, pada Selasa (3/9/2024), menjadi momen bersejarah bagi Bank Jateng. Plt. Direktur Utama Bank Jateng, Irianto Harko Saputro, mengungkapkan rasa syukur atas penghargaan ini. ""Penghargaan ini adalah bukti nyata bahwa Bank Jateng telah berhasil membangun hubungan yang kuat dengan masyarakat Jawa Tengah. Kepercayaan ini akan terus kami jaga dan tingkatkan melalui inovasi produk dan layanan yang lebih baik,"" ujar Irianto. Lebih lanjut, Irianto menambahkan bahwa pihaknya akan terus berupaya untuk menjadi bank pilihan utama masyarakat Jawa Tengah. ""Dengan terus berinovasi dan memberikan pelayanan terbaik, kami yakin Bank Jateng dapat berkontribusi lebih besar lagi dalam memajukan perekonomian daerah."" ungkapnya. Jawa Pos 7 Most Popular Brand of The Year 2024 merupakan penganugerahan bagi 7 brand terpopuler dalam 60 kategori sektor. Survei dan peratingan dilakukan oleh Jawa Pos bersama Infovesta, salah satu perusahaan riset dan pengolahan data bonafid di Indonesia menggunakan metode multistage area random sampling yang dijalankan di 20 kota besar. Survei melibatkan 19 ribu responden berusia produktif yang mayoritas berdomisili di DKI Jakarta (15,8 persen), Jawa Timur (10,9 persen), Jawa Barat (10,0 persen), Banten (9,0 persen), Jawa Tengah (8,9 persen), dan lain-lain. CEO Jawa Pos Media, Leak Kustiyo, menyampaikan bahwa penghargaan ini memiliki nilai eksklusivitas yang tinggi. ""Penghargaan ini bisa diibaratkan seperti Bitcoin dalam dunia cryptocurrency, karena kelangkaan dan nilai yang dimilikinya. Kami berharap penghargaan ini dapat memberikan semangat baru bagi penerima, serta memperkuat komitmen untuk terus menghadirkan yang terbaik bagi masyarakat,"" ujar Leak. Sementara itu, Menteri Koordinator Bidang Perekonomian RI, Airlangga Hartarto, yang diwakili oleh Staf Ahli Bidang Transformasi Digital, Kreativitas, dan Sumber Daya Manusia Kementerian Perekonomian, DR Rizal Edwin Manansang, Ak., M.Sc, mengungkapkan bahwa penghargaan ini merupakan bukti bahwa brand-brand Indonesia mampu bersaing di kancah Internasional. ""Hal ini tidak hanya membanggakan, tetapi juga menjadi inspirasi bagi kita semua untuk terus berinovasi dan meningkatkan daya saing,"" ujarnya. (adv/adv)","Selasa, 10 Sep 2024 00:00 WIB",Ekonomi
RI Butuh Rp219 T Buat Capai Bauran EBT 20 Persen,"Kementerian Energi dan Sumber Daya Mineral (ESDM) mencatat Indonesia membutuhkan investasi sebesar US$14,2 miliar atau Rp219,4 triliun (kurs 15.454 per dolar AS) untuk bisa mencapai peningkatan kapasitas bauran energi baru dan terbarukan (EBT) sebesar 8,2 Giga Watt (GW) pada 2025. Direktur Jenderal Energi Baru Terbarukan dan Konservasi Energi (Dirjen EBTKE) Kementerian ESDM Eniya Listiani Dewi mengatakan dengan investasi US$14 miliar, bauran EBT yang saat ini baru 13,93 persen bisa meningkat menjadi 20 persen. ""Untuk mencapai bauran yang sesuai dengan Rencana Usaha Penyediaan Tenaga Listrik (RUPTL) masih perlu di mana investasi yang diperlukan adalah US$14 miliar, mungkin sekitar Rp200 triliun,"" katanya dalam media briefing, Senin (9/9). ""Kalau kita punya investasi US$14 miliar, dalam satu tahun depan bauran EBT bisa menyentuh 20 persen,"" imbuhnya. Gaji Pekerja Akan Dipotong Lagi untuk Program Pensiun Baru Eniya mengatakan jika ada investasi sebesar US$14 miliar maka target bauran EBT sebesar 2023 yang awalnya dicanangkan tercapai pada 2025 bisa tercapai. Namun, dalam Kebijakan Energi Nasional (KEN), target bauran EBT 23 persen ditargetkan baru tercapai pada 2029. ""(Target) 23 persen ini masih menjadi question kapan tercapainya, walaupun di KEN 23 persen itu di 2029, karena di 2030 direncanakan tercapai 25 persen. Jadi kuncinya cuma di investasi,"" katanya. Eniya sebelumnya mengakui pengembangan EBT di Indonesia masih jauh dari target. Ia yang baru dilantik pada Februari lalu itu mengatakan pandemi banyak menghambat rencana strategis pengembangan listrik dari EBT. ""Saya sangat aware ada anggapan ini impossible. Saya juga sadar bahwa waktu (untuk mengejar target) tinggal 1,5 tahun. Sekarang fokus kita adalah menaikkan investasi untuk proyek EBT,"" kata Eniya saat dihubungi CNNIndonesia.com. Saat dihajar pandemi lebih dari dua tahun, konsumsi listrik berkurang sehingga persediaan domestik berlebih. Akibatnya rencana proyek dari sektor EBT tak banyak dikembangkan PLN. Setelah pandemi lewat, Eniya optimistis proyek EBT bisa digenjot. ""Pasca Covid konsumsi listrik akan tumbuh (kembali) karena industri sedang semangat tumbuh. Sehingga 1-2 tahun ini kebutuhan Jawa-Bali juga pasti tumbuh, isu oversupply akan terkikis lah. Di wilayah Sumbar malah sudah defisit. Di Sulawesi juga naik konsumsinya karena banyak smelter untuk nikel,"" kata profesor bidang rekayasa sel bahan bakar ramah lingkungan ini. Pemerintah merencanakan beberapa perubahan kebijakan termasuk mencabut kewajiban pemakaian komponen dalam negeri untuk PLTS Atap untuk menggenjot investasi. PLN juga akan menaikkan penerimaan kuota PLTS Atap untuk tujuan yang sama. [Gambas:Video CNN] (fby/pta)","Senin, 09 Sep 2024 22:07 WIB",Ekonomi
"Copot Bayu Krisnamurthi, Erick Angkat Wahyu Suparyono Jadi Dirut Bulog","Menteri Badan Usaha Milik Negara (BUMN) Erick Thohir mengangkat Wahyu Suparyono menjadi Direktur Utama Perum Bulog menggantikan Bayu Krisnamurthi. ""Melalui Keputusan Menteri BUMN Nomor : SK-73/DHK.MBU.A/09/2024, Direktur Utama Perum Bulog Bayu Krisnamurthi bersama Purnomo Sinar Hadi sebagai Direktur Human Capital telah menyelesaikan pengabdiannya di Perum Bulog,"" ujar Sekretaris Perusahaan A Widiarso melalui keterangan resmi, Senin (9/9). Sebelum berlabuh di Bulog, Wahyu sebelumnya menjabat sebagai Direktur Utama ASABRI. Selain Wahyu, Erick juga mengangkat Wakil Direktur Utama Marga Taufiq dan Sudarsono Hardjosoekarto sebagai Direktur Human Capital. Profil Marimutu Sinivasan, Buron BLBI yang Ditangkap Saat Mau Kabur Marga Taufiq sebelumnya adalah Staf Khusus Yayasan Pengembangan Potensi Sumber Daya Pertahanan (YPPSDP) Kementerian Pertahanan Republik Indonesia. Sementara, Sudarsono Hardjosoekato merupakan Guru Besar Sosiologi dan Birokrat. ""Selain itu Beliau (Sudarsono Hardjosoekato) juga pernah menjabat sebagai Direktur Jendral Kesatuan Bangsa dan Politik Kementerian Dalam Negeri,"" ujar Widiarso. Berikut susunan Direksi Bulog terbaru: Direktur Utama: Wahyu SuparyonoWakil Direktur Utama: Marga TaufikDirektur Human Capital: Sudarsono HardjosoekartoDirektur Keuangan: Bagya MulyantoDirektur Bisnis: Febby NovitaDirektur Supply Chain dan Pelayanan Publik: Mokhamad SuyamtoDirektur Transformasi & Hubungan Kelembagaan: Sonya Mamoriska [Gambas:Video CNN] (fby/sfr)","Senin, 09 Sep 2024 21:36 WIB",Ekonomi
"Catat, Tarif Tol Dalam Kota Ini Segera Naik","PT Jasa Marga (Persero) Tbk melalui Jasamarga Metropolitan mengumumkan bakal menaikkan tarif di beberapa ruas jalan tol dalam kota. ""Dalam waktu dekat akan diberlakukan penyesuaian tarif untuk Ruas Tol Dalam Kota,"" tulis Jasamarga Metropolitan dalam unggahan instagramnya yang dikutip pada Senin (9/9). Penyesuaian tarif tol ini sesuai dengan Keputusan Menteri PUPR No. 2130/KPTS/M/2024 yang telah diatur dalam Pasal 48 ayat (3) Undang-Undang (UU) Nomor 38 Tahun 2004 tentang Jalan dan Pasal 68 ayat (1) Peraturan Pemerintah(PP) Nomor 15 Tahun 2005 tentang Jalan Tol. Untuk besarannya, Jasamarga Metropolitan memastikan dihitung berdasarkan laju inflasi. Basuki Terisak saat Pamitan ke DPR: Saya Mules Setiap Berangkat Rapat ""Berdasarkan regulasi tersebut, evaluasi dan penyesuaian tarif tol dilakukan setiap dua tahun sekali berdasarkan pengaruh laju inflasi,"" imbuh Jasamarga Metropolitan. Berikut daftar ruas jalan tol yang bakal naik tarifnya:1. Cawang-Tomang-Pluit2. Cawang-Tanjung Priok-Ancol Timur-Pluit. Berdasarkan bpjt.pu.go.id tarif Tol Cawang-Pluit baik ruas Cawang-Tomang-Pluit dan Cawang-Tanjung Priok-Ancol Timur-Pluit, yang berlaku saat ini sebagai berikut: Golongan I: Rp10.500Golongan II: Rp15.500Golongan III: Rp15.500Golongan IV: Rp17.500Golongan V: Rp17.500. [Gambas:Video CNN] (ldy/pta)","Senin, 09 Sep 2024 20:57 WIB",Ekonomi
Sri Mulyani Lapor Prabowo Kondisi APBN: Very Fruitful Discussions!,"Menteri Keuangan Sri Mulyani melaporkan perkembangan Anggaran Pendapatan dan Belanja Negara (APBN) 2024 dan tahun depan kepada Presiden Terpilih Prabowo Subianto hari ini (9/9). Ia menghadap Prabowo siang dan pembasahan berlangsung hingga sore hari. Tak sendiri menghadap Prabowo, Sri Mulyani ditemani Wakil Menteri Keuangan II Thomas Djiwandono, yang juga keponakan Prabowo. ""Senin siang sampai sore hari ini, saya bersama Wamenkeu Thomas Djiwandono melaporkan perkembangan APBN kepada Presiden Terpilih @prabowo,"" tulis Sri Mulyani dalam akun Instagram pribadinya @smindrawati, Senin (9/9). Profil Marimutu Sinivasan, Buron BLBI yang Ditangkap Saat Mau Kabur Pertemuan itu tampak santai. Dari konten yang diunggah, Sri Mulyani tampak tertawa dalam beberapa foto. Ia, Prabowo dan Thomas duduk melingkari meja bundar. Ada dua hal yang ia laporkan kepada Prabowo. Pertama, mengenai pelaksanaan APBN 2024 dan outlooknya yang akan ditutup Desember 2024 atau di bawah pemerintahan Prabowo. [Gambas:Instagram] ""Dengan demikian, beliau (Prabowo) mengetahui detail perkembangan pelaksanaan APBN yang sedang berjalan,"" ujarnya. Kedua, Sri Mulyani melaporkan perkembangan pembahasan RUU RAPBN 2025 di DPR dan arahan-arahan Prabowo mengenai berbagai usulan program dan anggaran yang disediakan. ""Arahan beliau sesuai program prioritas yang akan dicapai dalam pemerintahan baru 2024-2029. Excellent and very fruitful discussions!"" pungkasnya. [Gambas:Video CNN] (pta/pta)","Senin, 09 Sep 2024 20:35 WIB",Ekonomi
"Pertamina Hijaukan Besakih, Tanam 200 Pohon untuk Alam dan Masyarakat","PT Pertamina (Persero) melanjutkan komitmennya dalam menjaga lingkungan dengan menanam 200 pohon di Desa Besakih, sebuah desa yang terletak di lereng Gunung Agung, Bali. Kegiatan ini sendiri bukan sekadar penanaman pohon biasa, tetapi menjadi bagian dari upaya perseroan untuk melestarikan alam sekaligus memberdayakan masyarakat lokal melalui program perhutanan sosial. Desa Besakih dikenal tidak hanya karena keindahan alamnya, tetapi juga sebagai pusat spiritual dan budaya. Dengan latar belakang Gunung Agung yang megah, desa ini memiliki keanekaragaman hayati yang luar biasa dan nilai-nilai budaya yang mendalam. Dalam konteks ini, Pertamina mengambil peran untuk lebih dari sekadar menjaga alam. Program ini mendorong warga untuk aktif menanam pohon, yang akan memberikan manfaat jangka panjang, baik secara ekologis maupun ekonomis. Direktur Jenderal Perhutanan Sosial dan Kemitraan Lingkungan, Mahfudz, menyatakan bahwa kegiatan ini bertujuan untuk mendorong masyarakat agar aktif menanam pohon. ""Yang manfaatnya akan dirasakan oleh diri mereka sendiri, masyarakat sekitar, dan pemerintah. Kolaborasi dengan Pertamina membantu meningkatkan kapasitas masyarakat dalam membangun ekonomi dan melestarikan hutan,"" ujarnya dalam keterangan tertulis, Senin (9/9). Di sisi lain, Wakil Bupati Karangasem, I Wayan Arth, menilai Pertamina telah menunjukkan kepedulian luar biasa terhadap kelestarian alam. Program ini tak hanya berhenti di sini, tetapi harus dilanjutkan dan dikontrol. ""Pohon sangat penting bagi kehidupan, sebagai paru-paru dunia,"" tegas dia. Turut hadir dalam kegiatan tersebut, Corporate Secretary PT Pertamina (Persero), Brahmantya S. Poerwadi, menyampaikan apresiasinya atas kolaborasi ini. ""Pertamina berkomitmen mendukung ekosistem hijau berbasis kearifan lokal di Desa Besakih. Kami berharap upaya ini akan memberikan manfaat yang signifikan bagi masyarakat lokal, khususnya kelompok usaha perhutanan sosial,"" katanya. Senada, Ketua LPHD Mahawana Basuki, I Nyoman Artana, juga menekankan pentingnya menjaga keberlanjutan hutan desa. ""Kami menanam pohon Pinang yang digunakan dalam upacara adat serta ijuk untuk memperbaiki atap Pura Besakih. Ini tidak hanya melestarikan hutan, tetapi juga mempertahankan nilai-nilai budaya lokal,"" ujarnya. Sebagai informasi, program penanaman pohon ini merupakan salah satu kegiatan tanggung jawab sosial lingkungan (TJSL) Pertamina. Melalui sinergi antara Pertamina, KLHK, dan masyarakat, diharapkan Desa Besakih dapat terjaga kelestarian alam dan kesejahteraan masyarakatnya melalui perhutanan sosial. Vice President Corporate Communication Pertamina, Fadjar Djoko Santoso, menambahkan Desa Besakih telah menjadi contoh suksesnya integrasi antara pelestarian lingkungan dan pengembangan ekonomi berbasis komunitas. ""Kami berharap peran Pertamina dalam keberlanjutan di lingkungan dan masyarakat ini, dapat menjadi energi bagi pertumbuhan perekonomian,"" pugkas dia. (rir)","Senin, 09 Sep 2024 20:35 WIB",Ekonomi
Menhub Ungkap Peluang Harga Tiket Pesawat Turun 10 Persen,"Menteri Perhubungan Budi Karya Sumadi berkomentar soal rencana penurunan harga tiket pesawat sebesar 10 persen meski hal tersebut bergantung pada keputusan Menteri Keuangan Sri Mulyani. Namun, ia menekankan harga tiket pesawat tak bisa langsung ditentukan turun berapa persen. Terlebih, ada poin-poin yang dianggap dilema dengan Kemenkeu. ""Prosesnya (pembahasan penurunan tiket pesawat) harus dilakukan. Ada empat yang saya sampaikan dalam usulan saat rapat dengan Pak Menko Marves (Luhut Binsar Pandjaitan),"" kata Budi di Kompleks DPR RI, Jakarta Pusat, Senin (9/9). ""Pertama, berkaitan dengan pajak-pajak alat dan suku cadang. Itu prinsipnya sudah disetujui dan sedang dilakukan upaya perbaikan di Kementerian Keuangan,"" sambungnya. Basuki Terisak saat Pamitan ke DPR: Saya Mules Setiap Berangkat Rapat Kedua, Budi menyinggung perdebatan masalah avtur. Ia menekankan masalah bahan bakar pesawat juga sudah dibawa ke dalam rapat. Ia menegaskan tidak boleh ada monopoli dalam penyediaan avtur, melainkan multiprovider. Ini juga didasarkan pada rekomendasi Komisi Pengawas Persaingan Usaha (KPPU). Ketiga, Budi menyoroti soal pajak pertambahan nilai (PPN) dalam tiket pesawat, salah satunya untuk avtur. Ia menegaskan negara lain tak ada yang menari pungutan serupa Indonesia. ""Namun demikian, dalam diskusi kami dengan menteri keuangan (Menkeu Sri Mulyani), kami mengerti bahwa apabila PPN itu dihilangkan, maka ada PPN yang lain juga harus dihilangkan,"" tuturnya. ""Jadi, memang dilematis untuk hal PPN itu,"" imbuh Budi. Keempat, pemerintah akan mengkaji cost atau biaya lain yang timbul selama ini. Ia mengatakan hal yang paling mungkin ditempuh negara adalah poin nomor satu, yakni penurunan atau pembebasan pajak dan alat suku cadang pesawat. Selain itu, pembahasan soal menekan biaya avtur. ""Ya mungkin (bisa turun) 10 persen (harga tiket pesawat), tapi kita masih menunggu lagi final dari kedua hal tersebut,"" jelas Budi. ""Ya kalau keputusan itu jalan, ya menurun (harga tiket pesawat). Kalau enggak, ya gak bisa turun,"" tandasnya. [Gambas:Video CNN] (skt/pta)","Senin, 09 Sep 2024 20:05 WIB",Ekonomi
Basuki Terisak saat Pamitan ke DPR: Saya Mules Setiap Berangkat Rapat,"Menteri PUPR Basuki Hadimuljono terisak saat pamitan dengan Komisi V DPR RI. Pria yang akrab disapa Pak Bas itu terharu saat menyampaikan salam perpisahan. Perpisahan itu dilakukan dalam rapat kerja (raker) terakhir Komisi V DPR RI 2019-2024 dengan para mitranya di DPR. ""Saya atas nama keluarga besar Kementerian PUPR mengucapkan terima kasih atas semua pengawasan dan atensi yang bapak (Komisi V DPR RI) berikan kepada Kementerian PUPR,"" tutur Basuki dalam Raker dengan Komisi V DPR RI di Jakarta Pusat, Senin (9/9). ""Walaupun setiap raker, berangkat, saya pasti mules. Tapi ternyata raker itu sangat membantu (dan) mendorong saya, khususnya sebagai menteri untuk koreksi kepada pimpinan eselon I kami. Izinkan saya mengucapkan terima kasih,"" tambahnya. Profil Marimutu Sinivasan, Buron BLBI yang Ditangkap Saat Mau Kabur Basuki dan jajaran Kementerian PUPR berdiri kemudian menunduk berterima kasih kepada para anggota DPR RI. Ia lantas mengucapkan kata-kata perpisahan yang sudah dirangkai rapi. Anak buah Presiden Joko Widodo itu tak dapat menahan rasa haru. Terlebih, Basuki sudah menjabat sebagai menteri PUPR selama 10 tahun alias dua periode Jokowi. ""10 tahun telah berlalu kita bersama, berkarya untuk membangun bangsa. Andai kata ada kata-kata yang tidak sama, mohon maaf please jangan dipendam selama-lamanya. Sakinah mawadah warahmah adalah harapan semua keluarga dan kita semua. Walaupun tiba saatnya kini berpisah, semoga silaturahmi tetap dapat kita jaga,"" tutur Basuki. ""Sekali lagi terima kasih bapak atas semuanya, tidak mudah membina hubungan kekeluargaan seperti di Komisi V ini. Apapun yang bapak-bapak sampaikan, kami rasakan itu memang tujuannya baik untuk membangun kita semua,"" tandasnya. Salam perpisahan juga disampaikan Menteri Perhubungan Budi Karya Sumadi yang hadir dalam rapat tersebut. Ia turut meminta maaf kepada para wakil rakyat. Menhub mengatakan selama ini komunikasinya dengan Komisi V DPR RI cukup intens. Meski ada duka, Budi menegaskan lebih banyak suka yang ia dan jajaran Kementerian Perhubungan rasakan. ""Atas nama semua rekan-rekan di Kementerian Perhubungan mengucapkan mohon maaf apabila ada hal-hal yang kurang memenuhi hal-hal merupakan aspirasi masyarakat. Terutama karena memang ada hal yang belum atau tidak dapat kita penuhi,"" ucap Budi. ""Insyaallah di masa mendatang kita tetap bisa menjalankan dengan cara-cara yang baik,"" tutupnya. Pada raker kali ini, Kementerian PUPR dan Kemenhub sama-sama mendapatkan persetujuan tambahan anggaran di 2025. Semula, Basuki Cs mendapatkan Rp75,63 triliun di RAPBN 2025, lalu ditambah menjadi Rp136,94 triliun. Kemenhub juga disuntik Rp55,87 triliun, sehingga anggarannya naik dari Rp24,76 triliun ke Rp80,63 triliun pada tahun depan. Menteri PUPR Basuki Hadimuljono lantas bernyanyi Kemesraan-Iwan Fals. Ia memimpin momen nyanyi bersama itu dengan para wakil rakyat. [Gambas:Video CNN] (skt/pta)","Senin, 09 Sep 2024 19:38 WIB",Ekonomi
